{
  "number": 190,
  "title": "Der eiskalte Clown",
  "description": "Dieser Winter dauert lang in der Millionenstadt. Die Schneedecke ist weit entfernt davon zu schmelzen und Klößchen wird von einem ziemlich lästigen Schnupfen geplagt. All das zusammen ist zwar nicht gerade angenehm, aber nichts im Vergleich zu dem, was dann passiert. Alles beginnt mit dem Einbruch im Feinkostladen von Gabys Mutter. TKKG ahnen nicht, was dieses Verbrechen nach sich ziehen wird: Angst, Erpressung und das Zerbrechen von Freundschaften. Jemand scheint es auf TKKG abgesehen zu haben - und hat dabei jeden Schritt penibel geplant...",
  "release_year": 2015,
  "release_date": null,
  "duration_seconds": 3742,
  "cast": [
    {
      "role": "Erzähler",
      "person": "Wolfgang Kaven"
    },
    {
      "role": "Tim / Tarzan / Peter Carsten",
      "person": "Sascha Draeger"
    },
    {
      "role": "Karl Vierstein / Computer",
      "person": "Niki Nowotny"
    },
    {
      "role": "Klößchen / Willi Sauerlich",
      "person": "Manou Lubowski"
    },
    {
      "role": "Gaby Glockner / Pfote",
      "person": "Rhea Harder"
    },
    {
      "role": "Kommissar Emil Glockner",
      "person": "Wolfgang Draeger"
    },
    {
      "role": "Margot Glockner",
      "person": "Renate Pichler"
    },
    {
      "role": "Thorsten",
      "person": "Stephan Benson"
    },
    {
      "role": "Holger",
      "person": "Stephan Benson"
    },
    {
      "role": "Hannes",
      "person": "Jona Mues"
    },
    {
      "role": "Jorina",
      "person": "Soi Anifantis"
    },
    {
      "role": "Werner",
      "person": "Jesse Grimm"
    },
    {
      "role": "Georg",
      "person": "Tim Kreuer"
    },
    {
      "role": "Sabine",
      "person": "Julia Fölster"
    }
  ],
  "production": [
    {
      "credit": "Produktion und Regie",
      "value": "Heikedine Körting"
    },
    {
      "credit": "Buch",
      "value": "Martin Hofstetter nach Motiven von Stefan Wolf"
    },
    {
      "credit": "Effekte",
      "value": "André Minninger"
    },
    {
      "credit": "Redaktion",
      "value": "Maike Nagel und Wanda Osten"
    },
    {
      "credit": "Geräusche",
      "value": "Wanda Osten"
    },
    {
      "credit": "Cover Illustration",
      "value": "Comicon S.L. - nach Artwork-Vorlagen von Reiner Stolte"
    },
    {
      "credit": "Rahmendesign",
      "value": "KB&B"
    },
    {
      "credit": "Gestaltung",
      "value": "Atelier Schoedsack"
    },
    {
      "credit": "„TKKG - Die Profis in spe“",
      "value": "Bonda / Büscher"
    },
    {
      "credit": "Musik",
      "value": "Tonstudio EUROPA"
    },
    {
      "credit": "Weitere Angabe",
      "value": "Eine Produktion der SONY MUSIC ENTERTAINMENT Germany GmbH"
    }
  ],
  "tracks": [
    {
      "position": 1,
      "title": "Scherben bringen Glück?"
    },
    {
      "position": 2,
      "title": "Das Huhn kommt zum Gockel"
    },
    {
      "position": 3,
      "title": "Das wünscht sich doch jedes Mädchen, oder?"
    },
    {
      "position": 4,
      "title": "Im tief verschneiten Wald"
    },
    {
      "position": 5,
      "title": "Krusty, der Clown"
    },
    {
      "position": 6,
      "title": "Der verstorbene Vater"
    },
    {
      "position": 7,
      "title": "Zum Stehlen gezwungen"
    },
    {
      "position": 8,
      "title": "Die Katze läßt das Mausen nicht"
    },
    {
      "position": 9,
      "title": "Eine kleine, dicke Robbe"
    },
    {
      "position": 10,
      "title": "Klößchen und das Eis"
    }
  ],
  "editions": [
    {
      "Medium": "CD",
      "Label": "EUROPA",
      "Erscheinungstermin": "13. Februar 2015",
      "EAN": "888750377425"
    }
  ],
  "sources": [
    {
      "url": "https://www.hoerspiel-request.de/tkkg.shtml#f190",
      "retrieved_at": "2026-10-09",
      "fields": [
        "cast",
        "description",
        "duration_seconds",
        "release_year",
        "title"
      ]
    },
    {
      "url": "https://www.tkkg-site.de/de/hoeren/hoerspiele/serie/folge-190/inhalt.html",
      "retrieved_at": "2026-10-09",
      "fields": [
        "cast",
        "description",
        "editions",
        "production",
        "title",
        "tracks"
      ]
    }
  ]
}
