{
  "number": 192,
  "title": "Feuer auf Gut Ribbeck!",
  "description": "Eigentlich wollten TKKG nur ein paar ruhige Sommertage bei Gabys Brieffreundin Sabine in einem SOS-Kinderdorf verbringen. Als Tim, Karl, Gaby, Klößchen und Sabine - teils hoch zu Ross, teils auf dem Drahtesel - von einem kleinen Ausflug zum nahen Reitstall zurückkehren, eröffnet sich ihnen ein schreckliches Bild: Gut Ribbeck brennt lichterloh! Ein Unfall oder vielleicht doch Brandstiftung? Wer hätte ein Motiv, die Stallungen auf Gut Ribbeck anzuzünden? TKKG machen sich an die Arbeit, sammeln Indizien und fügen scharfsinnig die einzelnen Puzzleteile zusammen. Sie sind dem möglichen Täter auf der Spur - glauben sie zumindest.",
  "release_year": 2015,
  "release_date": null,
  "duration_seconds": 3681,
  "cast": [
    {
      "role": "Erzähler",
      "person": "Wolfgang Kaven"
    },
    {
      "role": "Tim / Tarzan / Peter Carsten",
      "person": "Sascha Draeger"
    },
    {
      "role": "Karl Vierstein / Computer",
      "person": "Niki Nowotny"
    },
    {
      "role": "Klößchen / Willi Sauerlich",
      "person": "Manou Lubowski"
    },
    {
      "role": "Gaby Glockner / Pfote",
      "person": "Rhea Harder"
    },
    {
      "role": "Sabine",
      "person": "Merete Brettschneider"
    },
    {
      "role": "Alfred Geitner",
      "person": "Wolfgang Rositzka"
    },
    {
      "role": "Horst Peters",
      "person": "Rüdiger Hellmann"
    },
    {
      "role": "Philipp Ribbeck",
      "person": "Oliver Böttcher"
    },
    {
      "role": "Anna Ribbeck",
      "person": "Elga Schütz"
    },
    {
      "role": "Christa Högel",
      "person": "Tanja Geke"
    },
    {
      "role": "Lea",
      "person": "Emma Hellmann"
    },
    {
      "role": "Toni",
      "person": "Lino Böttcher"
    },
    {
      "role": "Feuerwehr-Einsatzleiter",
      "person": "Hans Tennigkeit"
    },
    {
      "role": "Feuerwehrmann",
      "person": "Stephan Chrzescinski"
    }
  ],
  "production": [
    {
      "credit": "Produktion und Regie",
      "value": "Heikedine Körting"
    },
    {
      "credit": "Buch",
      "value": "Martin Hofstetter nach Motiven von Stefan Wolf"
    },
    {
      "credit": "Effekte",
      "value": "André Minninger"
    },
    {
      "credit": "Redaktion",
      "value": "Wanda Osten, Maike Müller"
    },
    {
      "credit": "Geräusche",
      "value": "Wanda Osten, Alexander Körting"
    },
    {
      "credit": "Cover Illustration",
      "value": "Comicon S.L. - nach Artwork-Vorlagen von Reiner Stolte"
    },
    {
      "credit": "Rahmendesign",
      "value": "KB&B"
    },
    {
      "credit": "Gestaltung",
      "value": "Atelier Schoedsack"
    },
    {
      "credit": "„TKKG - Die Profis in spe“",
      "value": "Bonda / Büscher"
    },
    {
      "credit": "Musik",
      "value": "Tonstudio EUROPA"
    },
    {
      "credit": "Weitere Angabe",
      "value": "Eine Produktion der SONY MUSIC ENTERTAINMENT Germany GmbH"
    }
  ],
  "tracks": [
    {
      "position": 1,
      "title": "Feuerbrunst"
    },
    {
      "position": 2,
      "title": "Der geheime Zeuge"
    },
    {
      "position": 3,
      "title": "Peters schmeißt hin"
    },
    {
      "position": 4,
      "title": "Ein Fund mit Folgen"
    },
    {
      "position": 5,
      "title": "Alles neu denken"
    },
    {
      "position": 6,
      "title": "Du hast mich betrogen"
    },
    {
      "position": 7,
      "title": "Die Spur führt in den Wald"
    },
    {
      "position": 8,
      "title": "Hinterher!"
    },
    {
      "position": 9,
      "title": "Gezähmtes Feuer"
    }
  ],
  "editions": [
    {
      "Medium": "CD",
      "Label": "EUROPA",
      "Erscheinungstermin": "05. Juni 2015",
      "EAN": "888750526526"
    }
  ],
  "sources": [
    {
      "url": "https://www.hoerspiel-request.de/tkkg.shtml#f192",
      "retrieved_at": "2026-10-09",
      "fields": [
        "cast",
        "description",
        "duration_seconds",
        "release_year",
        "title"
      ]
    },
    {
      "url": "https://www.tkkg-site.de/de/hoeren/hoerspiele/serie/folge-192/inhalt.html",
      "retrieved_at": "2026-10-09",
      "fields": [
        "cast",
        "description",
        "editions",
        "production",
        "title",
        "tracks"
      ]
    }
  ]
}
