{
  "number": 123,
  "title": "Mordkomplott im Luxusklo",
  "description": "Im Luxus-Klo des Grandhotels Esplanade besprechen zwei Terroristen ihren Bombenanschlag auf den afrikanischen Staatspräsidenten Quimbambula, der heute Nachmittag hier erwartet wird und bemerken viel zu spät, dass sie belauscht werden. Der Zeuge entkommt. Doch sie haben ihn erkannt und jagen ihren Typ fürs Grobe hinterher, der ihn kaltstellen soll.",
  "release_year": 2000,
  "release_date": null,
  "duration_seconds": 2853,
  "cast": [
    {
      "role": "Erzähler",
      "person": "Wolfgang Kaven"
    },
    {
      "role": "Tim / Tarzan / Peter Carsten",
      "person": "Sascha Draeger"
    },
    {
      "role": "Karl Vierstein / Computer",
      "person": "Niki Nowotny"
    },
    {
      "role": "Klößchen / Willi Sauerlich",
      "person": "Manou Lubowski"
    },
    {
      "role": "Gaby Glockner / Pfote",
      "person": "Veronika Neugebauer"
    },
    {
      "role": "Kommissar Glockner",
      "person": "Edgar Bessen"
    },
    {
      "role": "Kautzner",
      "person": "Karl Knaup"
    },
    {
      "role": "Döbel",
      "person": "Tomas Kröger"
    },
    {
      "role": "Roland Fuge",
      "person": "Lennart Krüger"
    },
    {
      "role": "Jakob Fuge",
      "person": "Erik Schäffler"
    },
    {
      "role": "Theo Bockelmann",
      "person": "Klaus Dittmann"
    },
    {
      "role": "Politesse Samotzky",
      "person": "Alexandra Doerk"
    },
    {
      "role": "Nachrichtensprecher",
      "person": "Hubertus Borck"
    }
  ],
  "production": [
    {
      "credit": "Produktion und Regie",
      "value": "Heikedine Körting"
    },
    {
      "credit": "Effekte",
      "value": "André Minninger"
    },
    {
      "credit": "TKKG-Die Profis in spe",
      "value": "Bonda/Büscher"
    },
    {
      "credit": "Verlag",
      "value": "BMG Ariola Miller GmbH & Co. KG"
    },
    {
      "credit": "Design",
      "value": "Atelier Schoedsack"
    },
    {
      "credit": "Illustration",
      "value": "Reiner Stolte"
    },
    {
      "credit": "Weitere Angabe",
      "value": "Eine BMG Ariola Miller Produktion"
    },
    {
      "credit": "Weitere Angabe",
      "value": "© 2000 BMG Ariola Miller GmbH & Co. KG"
    }
  ],
  "tracks": [
    {
      "position": 1,
      "title": "Kradpilot im weißen Anzug"
    },
    {
      "position": 2,
      "title": "Jakob - ohne Benzin"
    },
    {
      "position": 3,
      "title": "Tim als Komponist"
    },
    {
      "position": 4,
      "title": "Scharfschütze - statt Bombe"
    },
    {
      "position": 5,
      "title": "Die Politesse kennt Theo"
    },
    {
      "position": 6,
      "title": "Verfolgung und Festnahme"
    },
    {
      "position": 7,
      "title": "Ballermann im Gangster-Auto"
    },
    {
      "position": 8,
      "title": "Auf unbestimmte Zeit verschoben"
    }
  ],
  "editions": [
    {
      "Medium": "MC / CD",
      "Label": "EUROPA",
      "Erscheinungstermin": "13. November 2000",
      "EAN": "743217960841 (MC) / 743217960827 (CD)"
    }
  ],
  "sources": [
    {
      "url": "https://www.hoerspiel-request.de/tkkg.shtml#f123",
      "retrieved_at": "2026-10-09",
      "fields": [
        "cast",
        "description",
        "duration_seconds",
        "release_year",
        "title"
      ]
    },
    {
      "url": "https://www.tkkg-site.de/de/hoeren/hoerspiele/serie/folge-123/inhalt.html",
      "retrieved_at": "2026-10-09",
      "fields": [
        "cast",
        "description",
        "editions",
        "production",
        "title",
        "tracks"
      ]
    }
  ]
}
